Drug,Drug Type,Condition,Date,Sales,Cases,Region,Price,Stock Availability,Sentiment,Review
Doxycycline,Antibiotic,Acne,10-03-2023,300,1500,"Wayanad, Kerala",22,Moderate,Effective,"""All I can say is that it changed my life. I had severe acne, but this year in January, I started doxycycline. In March, I stopped because my face was now clear. Till now, no doxycycline, no acne. I am really happy."""
Doxycycline,Antibiotic,Malaria  ,22-04-2023,305,2500,"Wayanad, Kerala",23,High,Not-Effective,"""Really bad. Have experienced really bad side effects, inflammation in both ears, terrible pain, vomiting, breast pain. Have only taken 8 pills and will stop tomorrow."""
Ciprofloxacin,Antibiotic (Fluoroquinolone),Bone and Joint Infections,22-04-2023,330,2500,"Wayanad, Kerala",25,High,Neutral,"""This drug is a blessing and a curse. I've had repeated bouts of osteomyelitis having been on cipro for months at a time. Not mention seven surgeries and one amputation to resolve the infections. Cipro got rid the infection but did cause three of my teeth to become brittle and break. So please use caution when using this medication"""
Azithromycin,Antibiotic (Macrolide),Ear Infection,20-05-2023,320,1600,"Wayanad, Kerala",22,Moderate,Not-Effective,"""I have an ear and throat infection on my left side. My Doctor prescribed zythromycin for 5 days. I have been suffering each day now and the zythromycin is NOT working. It is day 4 now and still feel like day 1. Doctor noted no improvement but still wants me to finish all doses."""
Fluticasone/Salmeterol (Advair),Combination Inhaler,Asthma,20-05-2023,320,1600,"Wayanad, Kerala",32,Moderate,Effective," ""I suffered from severe asthma from childhood till I was 50. Several attacks required hospitalization and I was on every medicine known to treat asthma over this time period including extended periods of prednisolone, rescue inhalers, plus theophyline, Alupent, etc. I started taking Advair in 2002 and since that time have had no attacks whatsoever. For the first 3 years I still carried my Albuterol inhaler but finally had the confidence to stop carrying them. A momentous day indeed and not without some trepidation. I have suffered no side effects at all and this medicine has been a life changer and potentially a life saver for me. I hope it can do the same for you. I never believed I would be rid of asthma but I am."""
Acetaminophen (Paracetamol),Analgesic/Antipyretic,Muscle Pain,20-05-2023,380,1600,"Wayanad, Kerala",32,Moderate,Effective," ""Paracetamol The only thing that works for me without any side effects, takes about 20 minutes to kick in, fantastic for muscle pain and anxiety attacks and insomnia, I take two 500mg tablets every 4 hours (four times a day), for two days then I'm okay."""
chlorine dioxide.,Nutritional Formula,Wasting,05-07-2023,320,1500,"Wayanad, Kerala",28,Moderate,Effective,"""I am always shocked at the effectiveness of CDS (chlorine dioxide solution), both topically and internally. It is an ion of chlorine, NOT bleach! Don't believe the fear, but read up and educate yourself before using it ensure safe and effective use."""
Azithromycin,Antibiotic (Macrolide),Sinusitis,05-07-2023,350,1500,"Wayanad, Kerala",23,Moderate,Not-Effective,"""Absolutely horrible side effects. Chest pain, shortness of breath and volatile heart beat from 2nd day of therapy onward (it was a five-day course). Ended up in ER, but EKG seemed normal. I am now in the third day after taking the last pill. Cleared up my sinusitis, but side effects are still lingering. Feeling hot on the inside, but no fever. Feelings of hopelessness, severe depression. Heart rate up to 130 only to drop to 50. Chest pain. Fear of a heart attack. No appetite whatsoever. Surviving on soup. One moment I feel like my old self, the next I feel like I'm losing my mind."""
Doxycycline,Antibiotic,Lyme Disease,20-08-2023,310,1600,"Wayanad, Kerala",27,Moderate,Not-Effective,"""For many years Amoxicillin was my drug of choice. Last year it stopped work on me. I had to use Doxycycline which caused terrible burns all over my skin after 1 week of use. Even the layer of sunscreen cream did not prevent the burns. It did not matter - if I stayed in the shade of the tree or if it was not sunny days - I got those burns. Because I had to do multiple jobs outside the house and go to the stores - this side effect created terrible problems for me. For somebody who can stay inside for entire month - this side effect probably non existent. The drug effectively cured the condition."""
Cephalexin,Antibiotic,Skin and Soft Tissue Infections,05-01-2024,320,1500,"Wayanad, Kerala",30,Moderate,Effective,"""I had recurring boils in one area. They would show up randomly so the dr. was never able to take a culture since they would come to a head and then pop whenever. He put me on a 20-day regimen of Keflex (500) and another ointment antibiotic that he told me to dab into my nose. He said for some odd reason, boils seem to start in the nose. I followed the instructions and had a minor recurrence several months later. I went immediately to see him so he put me back on Keflex. These boils were clustered and leaving scars in the area. They haven't recurred and the scars are gone. Since I caught them starting the 2nd time, they never had a chance to come to a head because I stayed on top of it. I highly recommend it for a skin bacterial infection."""
chlorine dioxide.,Nutritional Formula,Malnutrition,15-01-2024,350,1500,"Wayanad, Kerala",28,Moderate,Neutral,"""Used protocol for 2 months. Believe 20 ml in 8-10 ounces water eight times a day on the hour. Used to relieve arthritis symptoms. Symptoms were relieved. However, 7 months after stopping the protocol, I had chance to get blood tests. My kidneys are damaged and are now 30% functional. I have no clue if the CDS was the cause of the kidney damage, because my last blood test was decades ago. By the way, I still have zero symptoms indicating any issues with my kidneys. I still believe in CDS and its ability to cure many health issues. I merely want to suggest to proceed with your protocol slowly (maybe start with 10 ml and work up); take a day off each week to help your body (I didn't always take that day off); maybe even have a blood test after a month or so just to gauge how your body is dealing with the CDS ingestion."""
Ciprofloxacin,Antibiotic (Fluoroquinolone),Salmonella Food Poisoning,15-01-2024,350,1500,"Wayanad, Kerala",30,Moderate,Not-Effective,"""This drug made me feel so much sicker and I'll never take it again. I was prescribed Cipro for a possible stomach infection at 1000mg a day for 7 days. I immediately started experiencing body aches, brain fog, and loss of appetite. On day 4 my ankles and other joints started aching, popping, & swelling. After that I called my doctor & stopped taking the drug. Its been a few days now and I can say I feel 110x better than I felt when I was on it. I finally have my appetite back & my joints don't swell & ache all day..."""
Fluconazole,Antifungal,Fungal Infections (Skin),15-01-2024,320,1500,"Wayanad, Kerala",30,Moderate,Neutral,"""Wow. I landed in the ER with the sorest of sore throats. I have a systemic yeast infection. I'm taking fluconazole 100mg for a month this medication is no joke! It makes me insanely dizzy, my legs feel as if they will fail. No appetite whatsoever. Brain fog, confusion I'm going to have to bite the bullet until I'm finished in 2 weeks. The only plus side of the coin is that it is clearing up the Thrush."""
Fluticasone/Salmeterol (Advair),Combination Inhaler,COPD,15-01-2024,350,1500,"Wayanad, Kerala",30,Moderate,Not-Effective,"""The preliminary diagnosis is COPD pending approval from a pulmonologist. I have been taking this medication for 6 weeks. It is making me tired, lethargic, light-headed, and gaining weight. Feel good in the morning until inhaling the first dose of the day. After 6 weeks there is no improvement. Plan to stop this medication very shortly. I need my energy back and do not want to fight weight gain."""
Cephalexin,Antibiotic,Wound infections,15-01-2024,350,1500,"Wayanad, Kerala",29,Moderate,Not-Effective,"""Prescribed in the ER after a superficial burn infected (4cm). My dose is 500mg x 4 times a day for 5 days and I am on the second day. I called to hospital to ask severe side effects. Been on antibiotics many times but with this drug the side effects are a lot heavier: - Extreme tiredness and weakness that I can?t even open my eyes - sleeping 10-12 hours (getting pill each 6 hour) waking up with severe fatigue and body aches - my anxiety is off to roof - I have ongoing heaviness feeling and breathing spasms on my chest - my stomach is so weird (not burn, not pain) like someone punching me and I have a pressure on my belly, feeling like I had a big meal but I haven?t had anything other than 1-2 small meals in 3 days. - mild sore throat and minor cough - and my infection is not healing fast At this stage I am fighting with antibiotics more than the infection ! + I am on probiotics and having yogurt I hope this helps, other comments helped me to understand what?s going on w my body."""
Metronidazole,Antibiotic/Antiprotozoal,Giardiasis,15-01-2024,320,1500,"Wayanad, Kerala",30,Moderate,Not-Effective,"""For me metronidazole is simply does not work for the treatment of Giardia. I was prescribed 400mg x 3 per day for 5 days. The drug also has some nasty side effects, tight achilles heels, mental confusion and I was off balance whilst walking."""
Hydrocortisone,Corticosteroid,Eczema,15-01-2024,320,1500,"Wayanad, Kerala",30,Moderate,Effective," ""I have used this for a long time for my eczema and it has worked well."""
Azithromycin,Antibiotic (Macrolide),Typhoid Fever  ,15-01-2024,360,1500,"Wayanad, Kerala",20,Moderate,Effective,"""I experience that azithromycin has been a very active drugs in the treatment of many bacteria infection due to its activeness and varieties of infection which I have use it on and it responded very well(e.g typhoid, pneumonia, bronchitis e.t.c)"""
Acetaminophen (Paracetamol),Analgesic/Antipyretic,Dengue Fever,15-01-2024,320,1500,"Wayanad, Kerala",30,Moderate,Neutral,"""Pain: not very effective. No side effects, easy to use. Fever: definitely a 10. Always helps. This got a high rating due to the fever-reducing."""
Doxycycline,Antibiotic,Prostatitis  ,15-01-2024,320,1500,"Wayanad, Kerala",25,Moderate,Neutral,"""Moderate Prostatitis: Doxy working after a slow first 3 weeks. On week 6 now. Don't stop too soon if its working. Many experts recommend up to 12 weeks if necessary. No side effects except slight nausea for an hour if taking on an empty stomach."""
Fluconazole,Antifungal,Fungal Infections (Systemic),20-01-2024,350,1600,"Wayanad, Kerala",28,Moderate,Effective,"""Great! Finally 0 side effects and seems to be getting the job done after suffering armpit fungal infection for 5 months with other treatments but working and making it worse from bad reactions! I took for 2 weeks along with a non steroid topical and combined everything is looking good! Very satisfied!"""
Hydrocortisone,Corticosteroid,Skin Rash,05-02-2024,350,1500,"Wayanad, Kerala",30,Moderate,Not-Effective,"""Burning and major itching problems."""
Fluticasone/Salmeterol (Advair),Combination Inhaler,COPD,05-02-2024,340,1500,"Wayanad, Kerala",30,Moderate,Neutral," ""I started taking Advair 50/500 about 2 years ago. I must say that I have noticed almost a complete turn around with my breathing problems which is wonderful. However, I am in the emergency room almost half of every month due to severe heartburn, gallbladder attacks, severe stomach, throat and esophagus pain. It is all due to the Advair. Have been on all the breathing medicines and Advair works the best. Just don't know if I can keep dealing with all these side effects."""
Ciprofloxacin,Antibiotic (Fluoroquinolone),Skin and Soft Tissue Infections,05-02-2024,340,1500,"Wayanad, Kerala",30,Moderate,Effective,"""Overall it wasn?t bad at all, never had any side effects I was good all the way through. Make sure you drink water daily when taking these pills. DON'T be scared by the bad reviews you see on the internet!! I was a little scared at first myself but it was perfectly fine for me and even got rid of my infection which was great! I would definitely recommend this but personally I would recommend trying a home remedy before going with any drug."""
Metronidazole,Antibiotic/Antiprotozoal,Trichomoniasis,05-02-2024,350,1500,"Wayanad, Kerala",34,Moderate,Not-Effective,"""Took 1 tablet by mouth twice a day and it was prescribed for 7 days. Experienced multiple side affects such as vomiting constantly, headache, nausea and dizziness. I couldn't handle it anymore so I stopped on the second day. Didn't work for me."""
chlorine dioxide.,Nutritional Formula,Underweight,22-02-2024,480,2500,"Wayanad, Kerala",27,High,Effective,"""I use it for myself & pets taking internally for treating bacterial, viral & fungal infections. Use it as a topical spray for wounds/injuries &as a mouth rinse. More effective than any antibiotic & works much faster with less side. Also use for detox. Big Pharma/medicine wants you to fear it because IT WORKS & they can't make BIG BUCKS from it. It can also cure all the things they have been promising cures for, but haven't delivered. Research for yourself. It is very safe & effective."""
Fluconazole,Antifungal,Esophageal Infections,22-02-2024,390,2500,"Wayanad, Kerala",31,High,Neutral,"""So far have been on it for two weeks. 200mg per day for first two weeks. Now 50mg per day. No side effects at all. I still have problems swallowing and still have burps that send stuff up into my throat, but it does seem slightly easier. Am also on omeprazole for erosive gastritis, and that is slowly working too. Also am eating smaller portions to help avoid choking and nausea."""
Acetaminophen (Paracetamol),Analgesic/Antipyretic,Arthritis,22-02-2024,390,2500,"Wayanad, Kerala",31,High,Not-Effective,"""Almost useless and toxic, acetaminophen is all I can take concomitantly with Plavix."""
Metronidazole,Antibiotic/Antiprotozoal,Bacterial Vaginosis,25-02-2024,350,2000,"Wayanad, Kerala",31,Low,Effective,"""I've taken 3 rounds of metronidazole over my life, and never once experienced the side effects mentioned here. The odor disappears in a day or so, and my vagina feels/smells new and squeaky clean by the end of treatment! Everyone will react differently but I had to throw my 2 cents in as there are so many Not-Effective reviews for a drug that's been great for me."""
Azithromycin,Antibiotic (Macrolide),Bronchitis,25-02-2024,350,2000,"Wayanad, Kerala",26,Low,Neutral,"""I was prescribed and took the Azithromycin pack (Z Pack) when I came down with an acute case of Bronchitis. It was the traditional 2 pills at the first dose, and then 1 pill each following day. I started to feel a noticeable improvement by day 3, and was nearly completely better 7-8 days later. The medicine definitely worked for me, however, the side effects were strongly unpleasant. I had severe stomach pains, along with diarrhea, even when I did take the pills with food. Since the pills work for 10 days, i had the side effects for that long too. Overall though, I happy I took the Z pack and it helped cure me quickly."""
Doxycycline,Antibiotic,Bacterial Infection,25-02-2024,350,2000,"Wayanad, Kerala",21,Low,Neutral,"""I was prescribed doxycycline because of an allergy to penicillins. I did have a headache from this. My infection is better, I had some crusting sores that had not been healing, but they are now better. Also, a couple of sore teeth are no longer sore. I read up on how to take it as I wanted it to work?be sure not to eat for 2 hours before or an hour after for best absorption. Drink 8 oz of water with it, this does help to wash it down and with any stomach issues afterward. Don't lie down for at least 30 minutes after, preferably for up to an hour after, as it can cause esophageal irritation if you lie down. If you take any supplements containing calcium or magnesium, take those several hours after your last dose of doxycycline as they interfere with it. If you feel a little queasy after taking it, drink more water and wait a bit before trying food as a remedy."""
chlorine dioxide.,Nutritional Formula,Moderate Acute Malnutrition (MAM),25-02-2024,390,2000,"Wayanad, Kerala",28,Low,Not-Effective,"""The FDA has zero credibility since they lied throughout the entire covid crisis along with the CDC and WHO. This tells me that they are not concerned about their reputation in the very near future because they have been told there will not be a need for such an agency. And that goes along with every other agency and even our very own government. Why would they blatantly lie and risk a lifetime of building public trust and just throw it away like they did. Because they won?t need our trust or app"""
Hydrocortisone,Corticosteroid,Dermatitis,25-02-2024,360,2000,"Wayanad, Kerala",31,Low,Neutral,"""Its helped with itching and redness, put it on my brows and the bridge of my nose"""
Cephalexin,Antibiotic,Urinary Tract Infections (UTI),25-02-2024,350,2000,"Wayanad, Kerala",30,Low,Neutral,"""Have been taking this medicine for reoccurring UTIs, I take 500mg four times a day for 10 days. I have noticed that people have put mouth pain as a side effect. To be specific, with me, my tongue hurt, which I found out was 'thrush'. Easily taken care of with rinsing mouth out with colloidal silver or you can call your dentist and do what he or she recommends. I have had abdominal pain and diarrhea, however, to relieve me of the UTI, this was well worth it."""
Fluconazole,Antifungal,Vaginal Yeast Infections,25-02-2024,370,2000,"Wayanad, Kerala",29,Low,Not-Effective,"""I?ve had yeast infections in the past and this medication has made it go away with no problem at all. However, I?ve been having a yeast infection for 4 months now, yes 4 WHOLE MONTHS, and it doesn?t go away with taking this medication that my OBGYN only seems to be prescribing me. It?s nothing else but a yeast infection and Diflucan doesn?t work for me anymore. I?m going to have to try boric acid suppositories..."""
Acetaminophen (Paracetamol),Analgesic/Antipyretic,Cold,25-02-2024,430,2000,"Wayanad, Kerala",31,Low,Not-Effective,"""I'm not happy with this drug compared to paralgan, aspegic,asperine,...many others which are much more effective"""
Ciprofloxacin,Antibiotic (Fluoroquinolone),Gastrointestinal Infections,25-02-2024,380,2000,"Wayanad, Kerala",31,Low,Neutral,"""I was diagnosed with Salmonella poisoning on Tuesday. Been sick for 8 days now. Had severe nausea, diarrhea and stomach cramps. The first time I took Cipro it was ok, good enough to eat chicken noodle soup. The next morning I wasn?t able to eat (wasn?t able to eat whatsoever) so I pushed myself to eat 4 crackers and a ton of water to at least have something in my system and it made me EXTREMELY nauseous. Cipro makes me very drowsy so I was able to eventually ease the nausea and fall asleep for two hours, after that, felt fine. I also take Zofran (I have a fear of puking and being nauseous) to help ease my nausea along with Xanax for my anxiety. It is safe to mix these as there are no interactions, unless allergic. Just took my third one and I am extremely bloated. Can not get comfortable. Not sure if it?s related to my period or the cipro, either way it?s a very uncomfortable but tolerable feeling. Hoping the 4th pill I?ll be ok enough to at least eat two meals a day."""
Fluticasone/Salmeterol (Advair),Combination Inhaler,Asthma,25-02-2024,360,2000,"Wayanad, Kerala",31,Low,Neutral,"""It definitely helped me to breathe better, but puts me at risk for thrush. Once in a while I get thrush in the throat, which is annoying and I have to stop using Advair for a few days, and I struggle to breathe again about two days later. Clears up pretty quick. It?s a good idea to eat yogurt after rinsing your mouth, so now I eat yogurt all the time."""
Doxycycline,Antibiotic, Fever,25-02-2024,350,1500,"Wayanad, Kerala",20,Moderate,Effective,"""Contracted  fever jan 2015 diagnosed march 2015 after a series of blood tests. A very debillitating illness thankfully the right diagnosis plus doxycycline has helped considerably"""
Acetaminophen (Paracetamol),Analgesic/Antipyretic,Headache,05-03-2024,410,1500,"Wayanad, Kerala",30,Moderate,Neutral,"""Almost good for muscle pain"""
Hydrocortisone,Corticosteroid,Psoriasis,05-03-2024,350,1500,"Wayanad, Kerala",32,Moderate,Effective,"""Have periodic dry skin on my hands which leads to severe cracking. Understand if your issue is bacterial or fungal. Tried many fungal creams then bacterial cortisol. Works great, I use it almost every day. Hands are in great shape ( almost to soft lol)"""
chlorine dioxide.,Nutritional Formula,Severe Acute Malnutrition (SAM),10-03-2024,370,1500,"Wayanad, Kerala",26,Moderate,Neutral,"""Took care of my flu in 2 days"""
Azithromycin,Antibiotic (Macrolide),Sinusitis,10-03-2024,420,1500,"Wayanad, Kerala",24,Moderate,Effective,"""I am prone to sinus infections and usually get them with seasonal changes. Sometimes they come with ear stuffiness and usually with a fever, sore throat, and migraines. The exhaustion is the worst! With two small children, this time around, I had to get back on my feet quickly as there are no sick days. Well, Z-Pak works within hours, even on the pain of the sinus pressure! This has gotten me back to normal more times in my 34 years than I can count. I am extremely thankful for it because I have very few alternatives, being severely allergic to penicillin."""
Cephalexin,Antibiotic,Respiratory Tract Infections,10-03-2024,360,1500,"Wayanad, Kerala",32,Moderate,Neutral,"""I took this drug and it cleared up my problem in just 3 days."""
Acetaminophen (Paracetamol),Analgesic/Antipyretic,Fever,10-03-2024,450,1500,"Wayanad, Kerala",32,Moderate,Effective,"""paracetamol is the best and safe drug. its really amazing"""
Fluconazole,Antifungal,Fungal Infections (Nail),10-03-2024,420,1500,"Wayanad, Kerala",22,Moderate,Not-Effective,"""Took this fluconazole for systemic fungal infection. Took half the dose 50 mg and hours later I had a rash on my cheeks and felt like I was hit with he worst flu I?ve ever had. Extreme fatigue, chills, dizziness, nausea. Was asleep at night and woke up with an extreme panic attack and anxiety and I?m not an anxious person whatsoever and have had no issues prior with this. It felt like I was seriously not going to survive. I stopped taking it and 3 days later almost back to normal. I never write reviews but be careful with this stuff!"""
Ciprofloxacin,Antibiotic (Fluoroquinolone),Urinary Tract Infections (UTI),10-03-2024,390,1500,"Wayanad, Kerala",20,Moderate,Effective,"""I had a mild UTI that I was trying to treat naturally, but it didn't go away. So, I was forced to try an antibiotic. I was prescribed Cipro for 5 days. I had no side effects at all and felt 100% by day 3. I continued taking them through the 5th day even though all symptoms were already gone."""
Metronidazole,Antibiotic/Antiprotozoal,Amoebiasis,10-03-2024,360,1500,"Wayanad, Kerala",33,Moderate,Effective,"""This is the third time, that I have had to use this medicine. The first time, I had catastrophic diarrhea, a pharmacist said. THIS is what you need. Took one tablet, and IT WAS ALL GONE. The next time a few years later, and the same this, one tablet, and bingo. NOW, I live in Mexico, I am an American, so I don't have the stomach of a billy goat. Just got the runs again, that my tried and tested, over and over again herbal remedy wouldn't fix. Paid 50 pesos, for 30 tablets, took ONE, and I think I am good, took another one to make sure. Couldn't imagine, the bad effects that everyone is having???? puzzled !"""
Fluticasone/Salmeterol (Advair),Combination Inhaler,Asthma,10-03-2024,420,1500,"Wayanad, Kerala",32,Moderate,Not-Effective," ""Absolute garbage! I was switched over from Advair a week ago. My asthma has been completely under control for years with Advair. After one week of using this, my chest gets tight a couple of hours after using it, and I have mucus building up in my lungs that causes me to cough and hack all day. I?m actually better off just not taking any medicine at all. How did this drug get approved?"""
Hydrocortisone,Corticosteroid,Rash,10-03-2024,400,1600,"Wayanad, Kerala",30,Moderate,Effective,"""Worked wonders for my poison ivy rash. Quick relief and healing when all others failed"""
chlorine dioxide.,Nutritional Formula,Severe Acute Malnutrition (SAM),20-03-2024,420,1600,"Wayanad, Kerala",25,Moderate,Not-Effective,This doesn't work so well for me I feel so tired using this medicine
Ciprofloxacin,Antibiotic (Fluoroquinolone),Respiratory Tract Infections,20-03-2024,420,1600,"Wayanad, Kerala",32,Moderate,Not-Effective,"""Experienced diarrhea followed by muscle cramps in legs and feet. Immediately stopped the medication and will not take it again. This medication should not be legal."""
Metronidazole,Antibiotic/Antiprotozoal,Helicobacter Pylori Infection,20-03-2024,420,2500,"Wayanad, Kerala",31,High,Neutral," ""I'm on day three out of 1t day of taking a three tier medication schedule for h pylori, metronidazole, erythromyacin, and omeperazole. My doc suggested that I take one of the antibiotics, eat something, wait an hour, then take the second one. So far I?ve had no bad side effects, only a bad taste in my mouth."""
